[
  {
    "status": "done",
    "evidence": [
      {
        "ac_id": "AC-1",
        "result": "pass",
        "tests": ["auth-refresh.test.ts › ACCORD-1234/AC-1 refresh returns 401 for expired token"],
        "command": "bun test src/middleware"
      },
      {
        "ac_id": "AC-3",
        "result": "fail",
        "tests": ["auth-refresh.test.ts › ACCORD-1234/AC-3 refresh is rate limited"],
        "command": "bun test src/middleware",
        "note": "Expected 429, received 200 on 6th request"
      }
    ],
    "verify_output": "1 pass\n1 fail\n  AC-3 refresh is rate limited: Expected 429, received 200",
    "usage": {
      "prompt_tokens": 3000,
      "completion_tokens": 600
    }
  },
  {
    "status": "stuck",
    "question": "The e2e suite needs STAGING_API_KEY, which is not set in this environment.",
    "context": "verify step 2 runs `npm run e2e`.",
    "tried": "Checked .env.example and CI secrets docs.",
    "usage": {
      "prompt_tokens": 2000,
      "completion_tokens": 300
    }
  }
]
